0,1,2,3,4,5,6
"Atlantic City, New Jersey",,"List of counties in New Jersey, List of municipalities in New Jersey, Country, State",44.59,38497,"Atlantic City International Airport, New Jersey 1991–2020 normals, extremes 1958–present, Atlantic City, NJ Ocean Water Temperature",275549
Atyrau,Kazakhstan,"Regions of Kazakhstan, Countries of the world",,290700,Atyrau,355117
"Bartow, Florida",United States,"List of counties in Florida, List of sovereign states, U.S. state",136.71,19309,"Bartow 1SE, Florida, 1991–2020 normals, extremes 1892–present",584383
Bhilai,India,"List of districts of India, States and territories of India, Country",357.0,624700,,1064222
"Biloxi, Mississippi",United States,"List of counties in Mississippi, List of sovereign states, U.S. state",175.36,49449,"Biloxi, Mississippi",379582
"Bloomfield Hills, Michigan",United States,"List of counties in Michigan, List of sovereign states, U.S. state",13.05,4460,,4296250
"Broken Arrow, Oklahoma",United States,"List of counties in Oklahoma, U.S. state, Country",164.58,113540,"Broken Arrow, Oklahoma",1023988
Chakdaha,India,"List of districts of India, States and territories of India, Country",15.36,95203,,132855
"Concepción, Chile",Chile,"Provinces of Chile, Regions of Chile, Country",222.0,223574,"Concepción, Chile  1981–2010, extremes 1966–present",971285
Cúcuta,Colombia,"Departments of Colombia, Country",1119.0,777106,Cúcuta  1981–2010,1046347
"Deerfield Beach, Florida",United States,"List of counties in Florida, List of sovereign states, U.S. state",42.01,86859,"Deerfield Beach, FL",6166488
"Derby, Connecticut",United States,"List of regions of the United States, Country, Metropolitan area, U.S. state, County",14.0,12325,"Derby, Connecticut",861113
Fuxin,People's Republic of China,"Province of China, Country",10316.9,1647280,Fuxin,716494
"Grand Forks, North Dakota",United States,"Metropolitan statistical area, List of counties in North Dakota, U.S. state, Country",72.98,59166,,103462
"Great Falls, Montana",United States,"List of counties in Montana, U.S. state, Country",61.1,60442,"Great Falls, Montana , 1991–2020 normals, extremes 1891–present",84414
Guantánamo,Cuba,"Provinces of Cuba, Country",741.4,210407,,216734
"Gulf Breeze, Florida",United States,"List of counties in Florida, List of sovereign states, U.S. state",57.34,7437,,461227
"Helena, Montana",United States,"List of counties in Montana, U.S. state, Country",43.76,32091,"Helena, Montana, 1991–2020 normals, extremes 1880–present",83058
Hohhot,China,"Autonomous regions of China, Administrative divisions of the People's Republic of China, Country",17186.1,3446100,Hohhot,2944889
"Irving, Texas",United States,"List of counties in Texas, U.S. state, Country",176.04,216290,,6810913
Jinzhong,People's Republic of China,"Administrative divisions of the People's Republic of China, Province of China, Country",16408.0,3379498,"Jinzhong , 1981&ndash;2010",5433659
Joliette,Canada,"Provinces and territories of Canada, Regional county municipality, Region (Quebec), Country",23.6,20484,,49439
Kayseri,Turkey,"Provinces of Turkey, Regions of Turkey, Country",17043.0,1434357,Kayseri,1175886
Khargone,India,"List of regions of India, List of districts of India, States and territories of India, Country",,106454,Khargone,133368
"Kisii, Kenya",Kenya,"Country, County",68.0,112417,,97000
Larnaca,Cyprus,"Districts of Cyprus, Country",,51468,Larnaca,144200
Leshan,China,"Administrative divisions of the People's Republic of China, Province (China), Country",12827.5,3160168,Leshan,1236188
Lomé,Togo,"Regions of Togo, Prefectures of Togo, Country",99.14,837437,"Lomé  1961-1990, extremes 1892-present",1477660
Makassar,Indonesia,"Provinces of Indonesia, List of Sovereign states, Regions of Indonesia",175.77,1423877,Makassar,2698915
Malmö,Sweden,"Provinces of Sweden, Counties of Sweden, Country, Municipalities of Sweden",332.6,351749,"Malmö 2002-2021, Malmö, 1991–2018; extremes since 1901",749427
Managua,Nicaragua,"Departments of Nicaragua, Municipalities of Nicaragua, Country",267.0,1055247,"Managua, Nicaragua",1401687
Manizales,Colombia,"Departments of Colombia, Regions of Colombia, Country",571.84,434403,Manizales  1981–2010 normals,552155
"Miramichi, New Brunswick",Canada,"Provinces and territories of Canada, Country, County",,17537,"Miramichi Airport, 1981−2010 normals, extremes 1873−present",27523
"Missoula, Montana",United States,"List of counties in Montana, U.S. state, Country",90.54,73489,"Missoula, Montana  1981–2010 normals, extremes 1893–present",117922
"Mitchell, South Dakota",United States,"List of counties in South Dakota, List of sovereign states, U.S. state",31.85,15660,"Mitchell, South Dakota",23127
"Mitrovica, Kosovo",Kosovo,List of sovereign states,,85360,,"12326, 85360"
"Modesto, California",United States,"List of counties in California, List of regions of California, Country, State",116.04,218464,"Modesto, California",514453
Monclova,Mexico,"Country, Municipality, State",,231107,Monclova,381432
Ostrava,Czechia,"Regions of the Czech Republic, Districts of the Czech Republic, Country",214.23,279791,Ostrava,982000
Ottawa,Canada,"Provinces and territories of Canada, Country",2790.3,1017449,"Ottawa International Airport, 1981–2010 normals, extremes 1938–present, Ottawa , 1981–2010 normals, extremes 1872–present",1488307
Patna,India,"List of districts of India, States and territories of India, Division, Country",250.0,1683200,Patna Airport,3874000
"Peoria, Illinois",United States,"Country, State, County",130.93,113150,"Peoria, Illinois , 1991–2020 normals, extremes 1883&ndash;present",402391
Politics of Chandigarh,India,"Regions of India, Country",114.0,1054686,,960787
Port-au-Prince,Haiti,"List of sovereign states, Departments of Haiti, Administrative divisions of Haiti, Arrondissements of Haiti",36.04,987310,Port-au-Prince,2618894
Porto,Portugal,"List of regions and sub-regions of Portugal, Districts of Portugal, Administrative divisions of Portugal, Country",41.42,291962,5580.0,2421395
Prešov,Slovakia,"List of sovereign states, Regions of Slovakia, Districts of Slovakia",70.43,83897,Prešov,110978
"Pueblo, Colorado",United States,"List of counties in Colorado, List of municipalities in Colorado, List of sovereign states, U.S. state",145.254,111876,"Pueblo, Colorado",168162
Pula,Croatia,"List of sovereign states, Counties of Croatia",51.65,52411,Pula,105000
Raichur,India,"List of regions of India, Country, List of districts of India, States and territories of India",,232456,Raichur,251555
"Richmond, Virginia",United States,"U.S. state, Country",162.05,226610,"Richmond International Airport, Virginia",1263617
"Riverside, California",United States,"List of counties in California, U.S. state, Country",211.18,314998,Riverside,4599839
"Rudrapur, Uttarakhand",India,"List of districts of Uttarakhand, States and territories of India, Country",47.65,140857,,154485
"Sabinas, Coahuila",Mexico,"Country, Municipality, State",2345.2,63522,,177430
San Pedro Sula,Honduras,"Country, Department, Municipio",856.0,801259,"San Pedro Sula, Honduras  1961–1990, extremes 1944–present",1445598
Sandnes,Norway,"List of municipalities of Norway, Counties of Norway, Districts of Norway, Country",1040.56,85386,,319822
"Santa Ana, El Salvador",El Salvador,"Departments of El Salvador, List of sovereign states",400.01,245421,"Santa Ana, El Salvador",290000
Sopot,Poland,"Voivodeships of Poland, Powiat, Country",17.31,35049,,1080000
Sorel-Tracy,Canada,"Provinces and territories of Canada, Regional county municipality, Region (Quebec), Country",,34755,Sorel-Tracy,47772
Srinagar,India,"List of districts of Jammu and Kashmir, States and union territories of India, Division, Country",294.0,1180570,Srinagar,1273312
"St. Petersburg, Florida",United States,"List of counties in Florida, U.S. state, Country",350.93,258308,"St. Petersburg, Florida, 1991–2020 normals, extremes 1892–2015",2870569
Szczecin,Poland,"List of counties of Poland, List of sovereign states, Voivodeships of Poland",301.0,395513,60.0,777000
Tabacundo,Ecuador,"Provinces of Ecuador, Cantons of Ecuador, Countries of the world",,6107,,25594
"Tena, Ecuador",Ecuador,"Provinces of Ecuador, Cantons of Ecuador, Country",261.84,33934,,60880
Tepic,Mexico,"List of sovereign states, Municipalities of Nayarit, Administrative divisions of Mexico",,332863,Tepic,489511
Teseney,Eritrea,"Regions of Eritrea, Countries of the world, Districts of Eritrea",,4815,,65000
Thessaloniki,Greece,"Regional units of Greece, Geographic regions of Greece, Administrative regions of Greece, Country",19.307,317778,"120.0, Thessaloniki City Center 2005-2021",1091424
Thrissur,India,"List of districts of India, Country, State",101.42,315596,Thrissur,1854783
Tonghua,People's Republic of China,"Administrative divisions of the People's Republic of China, Province (China), Country",15195.0,1812114,Tonghua,446917
Toyama (city),Japan,"Prefectures of Japan, List of sovereign states, List of regions of Japan",1241.77,415844,Toyama,1066328
Valparaíso,Chile,"Provinces of Chile, Regions of Chile, Country",401.6,284630,"Valparaíso, Chile",930220
Vellore,India,"List of regions of India, List of sovereign states, Administrative divisions of India, List of districts of India, States and territories of India, Smart City Ranking India",,696110,Vellore,687981
Warangal,India,"List of sovereign states, List of districts of India, States and territories of India",406.97,704570,,753438
Weifang,People's Republic of China,"Province (China), Country",16143.1,9386705,Weifang,3095520
Zaozhuang,People's Republic of China,"Administrative divisions of the People's Republic of China, Province (China), Country",4563.22,3855601,Zaozhuang,975539
Zolotonosha,"Ukraine, Zolotonosha Raion, Cherkasy Oblast","Countries of the world, Raion, Oblast",21.65,27458,Zolotonosha,28768
